{"actor_origin":{"body_ref":"cluster:vector:compaii","embodiment_id":"embodiment:vector","incarnation_id":"incarnation:vector:0","principal_id":"compaii@vector"},"claim_id":"32000000-0000-4000-8000-000000000001","content_hash":"c627e06ebca830a075e7b0e653db30c0d77c722e6ca87a9e15b1e930eadc7d25","generation":1,"issued_at_ms":1800000000000,"item_id":"dm:curator-item:v1:gb_8qyvGi8HQxZE0uqplX2YTBGqtOrk18ATQe5wRh_k","lease_until_ms":1800000120000,"resource_fence":null,"resource_ref":"memory:proposal:dm032-vector","schema":"dm.curator.claim/v1"}
