{"actor_origin":{"body_ref":"cluster:legion:compaii","embodiment_id":"embodiment:legion","incarnation_id":"incarnation:legion:0","principal_id":"compaii@legion"},"claim_id":"31000000-0000-4000-8000-000000000001","content_hash":"7b21e5a1b9e0d831e822571032ed0454d4c9eace175331eb900ea67f26edcd21","generation":1,"issued_at_ms":1800000000000,"item_id":"dm:curator-item:v1:44k3NGYpnLU3BvIw3EEgngFnL0tvCQGcIwglgc1figc","lease_until_ms":1800000001000,"resource_fence":null,"resource_ref":"memory:item:synthetic","schema":"dm.curator.claim/v1"}